[
  {
    "id": "ext_cable_org_001",
    "title": "Magnetischer Kabel-Organizer fürs Homeoffice",
    "hook": "Endlich kein Kabelsalat mehr auf dem Schreibtisch.",
    "cat": "homeoffice",
    "price": "12–19 €",
    "price_value": 15,
    "fit": 91,
    "emoji": "🔌",
    "grad": "grad-1",
    "problem": "Ladekabel, USB-C-Kabel und Kopfhörer liegen lose auf dem Tisch und rutschen ständig weg.",
    "solution": "Magnetische Clips halten die Kabel an einer festen Stelle und machen den Arbeitsplatz sofort ordentlicher.",
    "pros": ["schnell montiert", "günstig", "sichtbarer Ordnungseffekt"],
    "cons": ["Klebepad hält nicht auf jeder Oberfläche", "nur für dünnere Kabel ideal"],
    "notfor": ["sehr dicke Netzteile", "raue Holzflächen"],
    "watch": ["Klebequalität", "Kabeldurchmesser", "Anzahl der Clips"],
    "affiliate": "",
    "affiliate_url": "",
    "merchant_name": "",
    "sponsored": false,
    "status": "active"
  },
  {
    "id": "ext_smart_plug_001",
    "title": "Smarte WLAN-Steckdose mit Strommessung",
    "hook": "Finde Stromfresser, bevor sie dich Geld kosten.",
    "cat": "smarthome",
    "price": "14–25 €",
    "price_value": 19,
    "fit": 88,
    "emoji": "🏠",
    "grad": "grad-2",
    "problem": "Viele Geräte verbrauchen unbemerkt Strom im Standby oder laufen unnötig lange.",
    "solution": "Die Steckdose misst Verbrauch und kann Geräte per App, Zeitplan oder Automatisierung schalten.",
    "pros": ["Stromverbrauch sichtbar", "Automatisierungen möglich", "oft schnell amortisiert"],
    "cons": ["App-Zwang möglich", "nicht jede Steckdose ist Matter-kompatibel"],
    "notfor": ["starke Dauerlasten ohne Leistungsreserve"],
    "watch": ["maximale Wattzahl", "Matter/HomeKit/Alexa-Kompatibilität", "Datenschutz"],
    "affiliate": "",
    "affiliate_url": "",
    "merchant_name": "",
    "sponsored": false,
    "status": "active"
  },
  {
    "id": "ext_travel_cable_bag_001",
    "title": "Reise-Kabeltasche für Technik-Zubehör",
    "hook": "Alle Ladegeräte an einem Ort — statt Chaos im Rucksack.",
    "cat": "reise",
    "price": "10–22 €",
    "price_value": 16,
    "fit": 84,
    "emoji": "✈️",
    "grad": "grad-3",
    "problem": "Auf Reisen verschwinden Kabel, Adapter und Powerbank schnell in verschiedenen Taschen.",
    "solution": "Eine kompakte Organizer-Tasche bündelt Kabel, Netzteile, Adapter und Speicherkarten übersichtlich.",
    "pros": ["günstig", "spart Suchzeit", "ideal für Handgepäck"],
    "cons": ["zu kleine Modelle werden schnell voll", "billige Reißverschlüsse nerven"],
    "notfor": ["große Kameraausrüstung"],
    "watch": ["Innenaufteilung", "Reißverschlussqualität", "Größe"],
    "affiliate": "",
    "affiliate_url": "",
    "merchant_name": "",
    "sponsored": false,
    "status": "active"
  },
  {
    "id": "ext_car_trash_bin_001",
    "title": "Kompakter Auto-Mülleimer mit Deckel",
    "hook": "Dein Auto sieht nicht mehr nach Snack-Schlachtfeld aus.",
    "cat": "auto",
    "price": "9–18 €",
    "price_value": 13,
    "fit": 79,
    "emoji": "🚗",
    "grad": "grad-4",
    "problem": "Bonbonpapier, Parktickets und Verpackungen landen schnell in Türfächern oder Fußraum.",
    "solution": "Ein kleiner Mülleimer mit Deckel sammelt Abfall unauffällig und ist leicht zu leeren.",
    "pros": ["mehr Ordnung", "einfach zu reinigen", "familientauglich"],
    "cons": ["nimmt Platz weg", "muss regelmäßig geleert werden"],
    "notfor": ["sehr kleine Innenräume"],
    "watch": ["Befestigung", "Deckel", "auswaschbares Material"],
    "affiliate": "",
    "affiliate_url": "",
    "merchant_name": "",
    "sponsored": false,
    "status": "active"
  },
  {
    "id": "ext_drawer_dividers_001",
    "title": "Verstellbare Schubladen-Teiler",
    "hook": "Aus einer Chaos-Schublade wird in Minuten ein System.",
    "cat": "ordnung",
    "price": "15–30 €",
    "price_value": 22,
    "fit": 86,
    "emoji": "📦",
    "grad": "grad-5",
    "problem": "Besteck, Bürozeug oder Badartikel rutschen in Schubladen ständig durcheinander.",
    "solution": "Verstellbare Teiler schaffen flexible Fächer ohne Bohren oder feste Einsätze.",
    "pros": ["flexibel", "schnell installiert", "für viele Räume nutzbar"],
    "cons": ["passt nicht in jede Schublade", "billige Federn halten schlecht"],
    "notfor": ["sehr flache Schubladen"],
    "watch": ["Längenbereich", "Federdruck", "Material"],
    "affiliate": "",
    "affiliate_url": "",
    "merchant_name": "",
    "sponsored": false,
    "status": "active"
  },
  {
    "id": "ext_led_motion_light_001",
    "title": "LED-Bewegungslicht für Schrank und Flur",
    "hook": "Licht genau dann, wenn du es brauchst.",
    "cat": "haushalt",
    "price": "12–28 €",
    "price_value": 20,
    "fit": 83,
    "emoji": "💡",
    "grad": "grad-6",
    "problem": "Dunkle Schränke, Treppen oder Flure sind nervig und oft unnötig schlecht beleuchtet.",
    "solution": "Akkubetriebene LED-Leuchten mit Bewegungsmelder lassen sich ohne Elektriker nachrüsten.",
    "pros": ["kein Bohren nötig", "Akku statt Kabel", "praktisch im Alltag"],
    "cons": ["muss geladen werden", "Sensorqualität variiert"],
    "notfor": ["dauerhafte Raumbeleuchtung"],
    "watch": ["Akkulaufzeit", "Magnetbefestigung", "Sensorwinkel"],
    "affiliate": "",
    "affiliate_url": "",
    "merchant_name": "",
    "sponsored": false,
    "status": "active"
  },
  {
    "id": "ext_fitness_bands_001",
    "title": "Widerstandsbänder-Set fürs Training zuhause",
    "hook": "Mehr Trainingsvarianten ohne großes Equipment.",
    "cat": "fitness",
    "price": "15–35 €",
    "price_value": 24,
    "fit": 82,
    "emoji": "💪",
    "grad": "grad-2",
    "problem": "Nicht jeder hat Platz oder Zeit für große Geräte, will aber trotzdem Krafttraining ergänzen.",
    "solution": "Widerstandsbänder ermöglichen Zugübungen, Mobility und Aktivierungstraining auf kleinem Raum.",
    "pros": ["platzsparend", "günstig", "vielseitig"],
    "cons": ["Qualität stark unterschiedlich", "kann bei falscher Nutzung reißen"],
    "notfor": ["maximales Krafttraining als Geräteersatz"],
    "watch": ["Materialqualität", "Widerstandsstufen", "Türanker"],
    "affiliate": "",
    "affiliate_url": "",
    "merchant_name": "",
    "sponsored": false,
    "status": "active"
  },
  {
    "id": "ext_screwdriver_precision_001",
    "title": "Präzisions-Schraubendreher-Set für Technik",
    "hook": "Kleine Reparaturen scheitern nicht mehr am falschen Bit.",
    "cat": "diy",
    "price": "18–40 €",
    "price_value": 29,
    "fit": 87,
    "emoji": "🔧",
    "grad": "grad-1",
    "problem": "Elektronik, Brillen, Spielzeug oder Gadgets brauchen oft Spezialbits, die man nicht zuhause hat.",
    "solution": "Ein Präzisions-Set deckt viele kleine Schraubenarten ab und macht Reparaturen realistischer.",
    "pros": ["viele Bits", "praktisch für Elektronik", "spart Reparaturkosten"],
    "cons": ["billige Bits nutzen sich ab", "nicht für grobe Arbeiten"],
    "notfor": ["große Schraubarbeiten"],
    "watch": ["Bit-Qualität", "magnetischer Griff", "Aufbewahrungsbox"],
    "affiliate": "",
    "affiliate_url": "",
    "merchant_name": "",
    "sponsored": false,
    "status": "active"
  },
  {
    "id": "ext_family_weekplanner_001",
    "title": "Magnetischer Wochenplaner für Familien",
    "hook": "Alle Termine sichtbar, bevor der Alltag explodiert.",
    "cat": "familie",
    "price": "12–25 €",
    "price_value": 18,
    "fit": 81,
    "emoji": "👨‍👩‍👧",
    "grad": "grad-4",
    "problem": "Familientermine, Schule, Sport und Einkäufe verteilen sich auf Chats, Zettel und Köpfe.",
    "solution": "Ein sichtbarer Wochenplaner an Kühlschrank oder Wand schafft Übersicht für alle.",
    "pros": ["visuell", "einfach", "gut für Routinen"],
    "cons": ["muss gepflegt werden", "nicht digital synchron"],
    "notfor": ["reine App-Nutzer"],
    "watch": ["Größe", "Stifte enthalten", "magnetische Haftung"],
    "affiliate": "",
    "affiliate_url": "",
    "merchant_name": "",
    "sponsored": false,
    "status": "active"
  },
  {
    "id": "ext_gift_multitool_key_001",
    "title": "Mini-Multitool für den Schlüsselbund",
    "hook": "Ein kleines Geschenk, das tatsächlich benutzt wird.",
    "cat": "geschenk",
    "price": "8–20 €",
    "price_value": 14,
    "fit": 78,
    "emoji": "🎁",
    "grad": "grad-5",
    "problem": "Viele kleine Geschenke sind nett gemeint, landen aber nach kurzer Zeit in der Schublade.",
    "solution": "Ein Mini-Tool mit Flaschenöffner, Schraubendreher oder Cutter-Funktion ist praktisch im Alltag.",
    "pros": ["klein", "nützlich", "guter Preis"],
    "cons": ["Qualitätsunterschiede", "nicht flugtauglich im Handgepäck"],
    "notfor": ["minimalistische Schlüsselbünde"],
    "watch": ["Material", "Kanten", "Funktionen"],
    "affiliate": "",
    "affiliate_url": "",
    "merchant_name": "",
    "sponsored": false,
    "status": "active"
  },
  {
    "id": "ext_tablet_stand_001",
    "title": "Verstellbarer Tablet- und Handy-Ständer",
    "hook": "Video, Rezept oder Call — endlich auf Augenhöhe.",
    "cat": "tech",
    "price": "10–24 €",
    "price_value": 17,
    "fit": 85,
    "emoji": "📱",
    "grad": "grad-3",
    "problem": "Handy oder Tablet liegen beim Arbeiten, Kochen oder Videocall oft im falschen Winkel.",
    "solution": "Ein stabiler Ständer bringt Geräte in einen besseren Blickwinkel und macht die Nutzung entspannter.",
    "pros": ["günstig", "universell", "besserer Winkel"],
    "cons": ["billige Modelle kippen", "nicht alle mit dicken Hüllen kompatibel"],
    "notfor": ["sehr schwere Tablets ohne stabile Basis"],
    "watch": ["Gewicht", "Gummierung", "Höhenverstellung"],
    "affiliate": "",
    "affiliate_url": "",
    "merchant_name": "",
    "sponsored": false,
    "status": "active"
  },
  {
    "id": "ext_energy_socket_timer_001",
    "title": "Digitale Zeitschaltuhr für Steckdosen",
    "hook": "Simple Lösung gegen unnötige Laufzeiten.",
    "cat": "energie",
    "price": "8–18 €",
    "price_value": 12,